{
  "id": "FOUNDATION-003",
  "summary": "实现跨 Worker/Node 的确定性 hello simulation",
  "milestone": "M0",
  "status": "CLOSED",
  "owner_role": "simulation_engineer",
  "reviewer_role": "qa_reviewer",
  "risk_level": "R3",
  "dependencies": [
    "FOUNDATION-001",
    "FOUNDATION-002"
  ],
  "scope": {
    "allowed_paths": [
      "package.json",
      "pnpm-lock.yaml",
      "packages/sim-core/**",
      "packages/protocol/**",
      "apps/sim-runner/**",
      "apps/web/src/worker/**"
    ],
    "forbidden_paths": [
      "docs/decisions/accepted/*",
      "PROJECT_STATUS.md"
    ]
  },
  "acceptance_criteria": [
    "固定 30 日命令序列跨环境 hash 相同",
    "模拟不引用 DOM/Node IO"
  ],
  "required_tests": [
    "pnpm test",
    "pnpm sim:determinism"
  ],
  "branch_or_worktree": null,
  "threads": {
    "simulation_engineer": "019ef53e-26ec-77f2-9460-3e8dad4d364d",
    "qa_reviewer": "019ef548-9e00-72f3-b998-d3da5ec75958"
  },
  "route_to": "qa_reviewer",
  "notes": [],
  "created_at": "2026-06-23T00:00:00Z",
  "updated_at": "2026-06-23T16:36:01.335Z"
}
