{
  "id": "M6-TASK-GRAPH-001",
  "summary": "Create minimal M6 Alpha system-complete task graph",
  "milestone": "M6",
  "status": "READY",
  "owner_role": "systems_architect",
  "reviewer_role": "qa_reviewer",
  "risk_level": "R3",
  "dependencies": [
    "M5-EXIT-HUMAN-GATE-001"
  ],
  "scope": {
    "allowed_paths": [
      "project/tasks/active/M6-TASK-GRAPH-001.json",
      "project/tasks/active/M6-*.json",
      "project/tasks/thread-registry.json",
      "project/messages/**",
      "project/goal-mode-state.json",
      "project/model-routing-state.json",
      "PROJECT_STATUS.md"
    ],
    "forbidden_paths": [
      "apps/**",
      "packages/**",
      "content-source/**",
      "tools/**",
      ".github/**",
      "docs/decisions/**",
      "docs/GATE-M0.md",
      "docs/GATE-M1.md",
      "docs/GATE-M2.md",
      "docs/GATE-M3.md",
      "docs/GATE-M4.md",
      "docs/GATE-M5.md",
      "docs/11-roadmap.md",
      "docs/13-risk-register-and-test-strategy.md",
      "docs/23-milestone-acceptance-matrix.md",
      "docs/27-autonomous-goal-mode.md",
      "MANIFEST.md",
      "SHA256SUMS.txt",
      "VALIDATION_REPORT.md"
    ]
  },
  "acceptance_criteria": [
    "Create a minimal, dependency-ordered M6 task DAG under project/tasks/active with explicit owner_role, reviewer_role, risk_level, dependencies, allowed_paths, forbidden_paths, acceptance_criteria, required_tests, route_to, and notes for every M6 task.",
    "The M6 DAG covers Roadmap and acceptance-matrix M6 goals without implementing them: start-to-victory playability, diplomacy, legitimacy, succession completion, layered AI, policy/event/encyclopedia surfaces, three-scenario data pipeline, map candidate path, batch auto-run and balance dashboard, accessibility core flows, Alpha no P0/P1 validation, and adviser intervention evidence.",
    "The M6 DAG explicitly preserves the M5 product-owner decision DEFER_MANUAL_NODE_BATTLE: no manual node battle implementation task, no manual node battle blocking spike, and no manual node battle research task may block M6, M7, or M8.",
    "The M6 DAG preserves Human Gates for frozen product/platform/core architecture changes, paid services, accounts/secrets, server/multiplayer, telemetry, arbitrary-code mods, release/commercial decisions, branding, major cultural-risk decisions, irreversible migrations, and any formal 1.0 scope reversal.",
    "Tasks are small enough for independent writer/reviewer routing, with no overlapping writer ownership for the same package or file region.",
    "No product code, package code, content-source data, roadmap edits, accepted ADR changes, M6 implementation work, production dependency changes, release work, telemetry, networking, or mod support is performed by this planning task.",
    "systems_architect writer and independent qa_reviewer reviewer produce validated handoffs before lead acceptance."
  ],
  "required_tests": [
    "git status --short",
    "node .agents/skills/monsoon-studio-orchestrator/scripts/taskctl.mjs validate M6-TASK-GRAPH-001",
    "node .agents/skills/monsoon-studio-orchestrator/scripts/taskctl.mjs list",
    "node .agents/skills/monsoon-studio-orchestrator/scripts/taskctl.mjs ready",
    "node -e JSON validation for all new M6 task files and DAG acyclicity/dependency existence/status shape",
    "node .agents/skills/monsoon-studio-orchestrator/scripts/validate-handoff.mjs <systems-handoff>",
    "node .agents/skills/monsoon-studio-orchestrator/scripts/validate-handoff.mjs <qa-handoff>",
    "git diff --check"
  ],
  "branch_or_worktree": "chore/m6-task-graph",
  "threads": {},
  "route_to": "lead_orchestrator",
  "notes": [
    "M6 starts only after M5 Gate PASS_WITH_LIMITS entered origin/main and M5-EXIT-HUMAN-GATE-001 is CLOSED.",
    "This task creates or restores the M6 task graph only; it must not implement diplomacy, legitimacy, layered AI, policy/events, encyclopedia, scenarios, map candidates, balance dashboard, accessibility, or Alpha validation behavior.",
    "Manual node battle remains deferred from M5 and the 1.0 mainline; do not create an implementation task or blocking spike/research task for M6, M7, or M8.",
    "M6 may create tasks that document the already-made manual node battle deferral only as non-blocking post-1.0 candidate tracking, not implementation authorization.",
    "M5 Gate PASS_WITH_LIMITS carries forward bounded limits from docs/GATE-M5.md and must not be re-described as an unconditional PASS."
  ],
  "created_at": "2026-06-27T05:01:21+08:00",
  "updated_at": "2026-06-27T05:01:21+08:00"
}
