{
  "id": "M4-AUTO-ENGAGEMENT-SIEGE-001",
  "summary": "Implement M4 automatic engagement resolution and siege choice loop",
  "milestone": "M4",
  "status": "DRAFT",
  "owner_role": "simulation_engineer",
  "reviewer_role": "systems_architect",
  "risk_level": "R3",
  "dependencies": [
    "M4-MARCH-SUPPLY-STATE-001"
  ],
  "scope": {
    "allowed_paths": [
      "packages/sim-core/**",
      "packages/protocol/**",
      "packages/sim-testkit/**",
      "apps/sim-runner/**",
      "tests/**",
      "project/goal-mode-state.json",
      "project/model-routing-state.json",
      "project/tasks/thread-registry.json",
      "project/tasks/active/M4-AUTO-ENGAGEMENT-SIEGE-001.json",
      "project/messages/**"
    ],
    "forbidden_paths": [
      "apps/web/**",
      "apps/desktop/**",
      "packages/client-core/**",
      "packages/map-renderer/**",
      "packages/ui/**",
      "packages/platform/**",
      "packages/save-format/**",
      "packages/content-schema/**",
      "packages/content-runtime/**",
      "content-source/**",
      "tools/**",
      ".github/**",
      "docs/decisions/**",
      "docs/GATE-M0.md",
      "docs/GATE-M1.md",
      "docs/GATE-M2.md",
      "docs/GATE-M3.md",
      "docs/11-roadmap.md",
      "docs/23-milestone-acceptance-matrix.md",
      "docs/27-autonomous-goal-mode.md",
      "PROJECT_STATUS.md",
      "MANIFEST.md",
      "SHA256SUMS.txt",
      "VALIDATION_REPORT.md"
    ]
  },
  "acceptance_criteria": [
    "When campaign forces meet an opposing force or fortified target, sim-core resolves a minimal automatic engagement using explicit deterministic inputs, stable tie-breakers, and auditable outcome reasons.",
    "Siege choices cover the M4 vertical slice only: invest/blockade, assault, continue, accept surrender when conditions are met, lift siege, or withdraw; all are submitted through GameCommand paths shared by player and AI.",
    "Surrender conditions and siege progress use explicit state fields and reason codes tied to supply, force, fortification, time, and defender estimates without hidden UI formulas.",
    "Casualties, supply loss, credit/reputation hooks, and campaign status updates are emitted as serializable events for later postwar handoff and validation.",
    "The task explicitly does not implement manual node battle, tactical battle UI, 3D battle, complex naval battle, full diplomacy, peace treaties, or multiplayer/server behavior."
  ],
  "required_tests": [
    "git status --short",
    "pnpm --filter @monsoon/sim-core test",
    "pnpm --filter @monsoon/protocol test",
    "pnpm sim:determinism",
    "pnpm test",
    "Scenario tests cover automatic field engagement, assault, blockade/continue, surrender, lift siege, and supply-driven siege failure.",
    "Property/invariant tests cover deterministic resolution order, no negative force/supply counts, explicit casualty/loss accounting, and shared player/AI command paths.",
    "node .agents/skills/monsoon-studio-orchestrator/scripts/taskctl.mjs validate M4-AUTO-ENGAGEMENT-SIEGE-001",
    "node -e JSON parse/shape check for M4-AUTO-ENGAGEMENT-SIEGE-001",
    "git diff --check"
  ],
  "branch_or_worktree": "feat/m4-auto-engagement-siege",
  "threads": {},
  "route_to": "systems_architect",
  "notes": [
    "This is automatic resolution for the M4 vertical slice, not a commitment to manual node battles; H-007 remains a later decision.",
    "Keep siege choices command/query based and deterministic; do not hide settlement or diplomacy logic in this task.",
    "Explicit exclusions for M4 remain: manual node battle, complex naval warfare, full diplomacy, 3D battle, multiplayer/server, telemetry, arbitrary-code mods, and frozen product or architecture changes."
  ],
  "created_at": "2026-06-25T22:49:34Z",
  "updated_at": "2026-06-25T22:49:34Z"
}
